"The Leroy Anderson House, the former home of Leroy Anderson in Woodbury, Connecticut, was named by the National Park Service to the National Register of Historic Places in December 2012. The Town of Woodbury designated the Leroy Anderson House as a historic house museum in April 2018. It is the headquarters of the Leroy Anderson Foundation, a 501(c)3 non-profit, charitable organization created in 2010 by Mrs. Eleanor Anderson, wife of Leroy Anderson.The Leroy Anderson House contains an exhibit about Leroy Anderson. Group Visits may be arranged by advance reservation. The house is open for general admission on Open Days in early and late Summer, in Autumn and in December. It is one of only a few homes of an American composer that is occasionally open to the public.",https://www.imdb.com/name/nm1180163/bio
"Shmuel Atzmon was born on June 29, 1929 in Poland. He is an actor and composer, known for Operation Black September (1976), The Story of Jacob and Joseph (1974) and Adam (1973).",https://www.imdb.com/name/nm0041219/bio
"Piers Wenger was born on June 29, 1972 in Stoke-on-Trent, Staffordshire, England as Piers John Wenger. He is known for his work on How I Live Now (2013), Housewife, 49 (2006) and Ashes to Ashes (2008).",https://www.imdb.com/name/nm1674322/bio
"Marga Pettersson was born on June 29, 1952 in Stockholm, Stockholms län, Sweden as Margareta Elisabet Pettersson. She is an actress, known for Reya (2014), Call of the Unseen and Fikaexperten (aka Just like me).",https://www.imdb.com/name/nm0678593/bio
"Naleah is originally from Modesto, Ca.Her mom wanted her to be a well behaved little girl so she enrolled her in ballet class. Naleah fell in love with it and at age 16 met her mentor Ann Reinking at Broadway Theater Project. After graduating from high school Naleah performed on Broadway in the hit ""The Boy From Oz"" along side Hugh Jackman, ""Chicago The Musical"" (tour), ""Fosse""(tour) and the Off- Broadway show ""No Strings"". She will always love singing and dancing.She and her husband are expecting their first child Nov 2010!",https://www.imdb.com/name/nm1817140/bio
"Sam Bailey was born on June 29, 1977 in Bexley, London, England as Samantha Florence Bailey. She has been married to Craig Pearson since January 29, 2003. They have three children.",https://www.imdb.com/name/nm5928415/bio
"Henrique Viana was born on June 29, 1936 in Lisbon, Portugal as Henrique dos Santos Viana. He is known for his work on Ill-Fated Love (1978), Olá Pai (2003) and O Herói e o Soldado (1961). He was married to Graça Braz and Ivone Silva. He died on July 4, 2007 in Lisbon.",https://www.imdb.com/name/nm0895669/bio
"Egon von Fürstenberg was born on June 29, 1946 in Lausanne, Vaud, Switzerland as Eduard Egon Peter Paul Giovanni Prinz zu Fürstenberg. He is known for his work on La piovra (1984), Sahara Heat (1987) and The Edge of Night (1956). He was married to Lynn Marshall and Diane von Fürstenberg. He died on June 11, 2004 in Rome, Lazio, Italy.",https://www.imdb.com/name/nm0902280/bio
"Revaz Gabriadze was born on June 29, 1936 in Kutaisi, Georgian SSR, Transcaucasian SFSR, USSR as Revaz Levanovich Gabriadze. He is a writer and director, known for Pasport (1990), Kin-dza-dza! (1986) and Rezo (2018).",https://www.imdb.com/name/nm0300175/bio
"David Black, born 29 June 1964 in Adelaide, South Australia, Australia; grew up in Melbourne and lives in Melbourne. He is an actor, writer, producer and director in films. He started off his creative endeavours as a cartoonist by publishing his first underground comic, ""Gooby"" at the age of 17. As a cartoonist, he had a cartoon strip, ""Punkz"", run in the national rock weekly magazine ""Juke"" in 1988 and worked as the editorial cartoonist for the national tabloid ""The Truth"" in 1989 and 1990. He published a comic book ""Punkz In Space"" in 1993.David is also a writer of short stories and his series ""Obsessions of a Shattered Psyche"" were published in Dark Angel Magazine in the 1990s. He has made 3 of those short stories into short films. His writing has also extended to covering the Australian Indie Movie industry in The Movie Blog and Oz Indie Cinema. He writes for The Australian Short Film Network Journal.David is also a bass player, singer and songwriter. He played in the theatrical gothic rock band, ""Darkness Visible"", which gigged across Melbourne from 1994. He has recorded 10 songs in the studio. It was the band that segued him into film making when he started making music videos. Between 2009 - 2017, he produced 10 music videos.David Black is an all-rounder when it comes to creative pursuits and this has helped his filmmaking immensely. He is involved in every aspect of the process from writing, prop making, costuming, through to editing and even marketing. He works with quite a variety of people and allows them as much creative freedom as possible, while overseeing each film from beginning to end. David has become best known for horror and schlock films, however most have a spiritual and psychological sub narrative, and can often be seen as a commentary on the modern world.",https://www.imdb.com/name/nm8084129/bio
"Abs Breen is of Turkish-Irish extraction. His name is short for Abidin, his middle name. He's the cool and calm one - laid back but strong headed. He's very comfortable with himself and is a natural performer, having grown up in a musical family in Hackney, he has sung, danced, rapped and DJ'd since childhood. A really romantic bloke that cites Titanic as his favourite film and ""would do anything for the girl I love"".",https://www.imdb.com/name/nm0106714/bio
"Robert Dastoli was born on June 29, 1985 in Stamford, Connecticut, USA. He is known for his work on Bottom Floor (2004), Machines of the Working Class (2011) and El Quetzal de Jade (2013).",https://www.imdb.com/name/nm1498874/bio
"Tarja Keinänen was born on June 29, 1950 in Oulu, Finland as Tarja Helena Keinänen. She is an actress, known for The Glory and Misery of Human Life (1988), Kovaa maata (1994) and Pohjanmaa (1988).",https://www.imdb.com/name/nm0445134/bio
"Mitchell Froom was born on June 29, 1953 in Sonoma County, California, USA. He has been married to Vonda Shepard since 2004. They have one child. He was previously married to Suzanne Vega and Connie Jester.",https://www.imdb.com/name/nm0296434/bio
"Carl-Heinz Schroth was born on June 29, 1902 in Innsbruck, Austria-Hungary. He was an actor and director, known for Jakob und Adele (1982), Congress Dances (1931) and Fräulein vom Amt (1954). He was married to Barbara Schroth, Karin Jacobsen, Ruth Hausmeister, Karin Jacobsen and Carola Krauskopf. He died on July 19, 1989 in Munich, Bavaria, West Germany.",https://www.imdb.com/name/nm0775594/bio
"Jasna Odorcic was born on June 29, 1961 in Osijek, Croatia. She is an actress, known for Najbolje godine (2009), Zakon ljubavi (2008) and Dar Mar (2020).",https://www.imdb.com/name/nm2313681/bio
"Writer, filmmaker and adventurer, Jon is a six-time grantee of the National Geographic Expeditions Council. One of the Society's 'Ocean Heroes,' his first assignment for National Geographic Magazine was documenting a 3,741 mile crossing of Antarctica by dogsled.Jon has written eleven books and produced/directed more than thirty documentary films. His feature documentaries include 'Dear President Obama,' 'Antarctica, on the Edge,' 'After the Spill' and 'Ghost Fleet.' (oceans8films.com)His National Geographic-sponsored Oceans 8 project took him and his teams around the world by sea kayak over the course of ten years (1999-2008), bringing back stories from the Aleutian Islands to French Polynesia, Gabon to Tasmania, and more, reporting on how the planet's one ocean and its various coastlines are faring in today's busy world.Jon lives in New York's Hudson Valley. He is the President of the One Ocean Media Foundation and Chairman of the Advisory Board of Adventurers and Scientists for Conservation.For the past several years, Jon and his One Ocean Media Foundation / Oceans 8 Films team have focused on a series of short films about the environmental risks to, and hopes for the Hudson River Valley, the birthplace of the American environmental movement. (hudsonriverstories.com)Jon is a Visiting Lecturer at Bard College, in the Environment and Urban Studies Department; tune into his weekly radio show/podcast, 'The Green Radio Hour with Jon Bowermaster,' at radiokingston.org.",https://www.imdb.com/name/nm3123587/bio
"Joe Johnson was born on June 29, 1981 in Little Rock, Arkansas, USA as Joe Marcus Johnson.",https://www.imdb.com/name/nm4256790/bio
"Ágúst Guðmundsson was born on June 29, 1947 in Reykjavík, Iceland. He is a director and writer, known for The Dance (1998), The Seagull's Laughter (2001) and Land og synir (1980).",https://www.imdb.com/name/nm0350271/bio
"Mickey Munday was born on June 29, 1945 in Miami, Florida, USA. He is an actor, known for The Lick Movie (2019), Cocaine Cowboys: Reloaded (2014) and Cocaine Cowboys (2006).",https://www.imdb.com/name/nm2666992/bio
"Ray Jackson was born on June 29, 1931 in Wandsworth, London, England. He was an actor, known for The Final Test (1953), Dunkirk (1958) and Frieda (1947). He died on October 25, 1989 in London.",https://www.imdb.com/name/nm0413954/bio
"Petr Stach was born on June 29, 1974 in Jablonec nad Nisou, Czechoslovakia. He is known for his work on Burning Bush (2013), A Walk Worthwhile (2009) and Mieletön elokuu (2013).",https://www.imdb.com/name/nm3127257/bio
"Tom Bade was born on June 29, 1946 in Brooklyn, New York, USA as Thomas Bade. He was an actor, known for Some of My Best Friends Are... (1971), Loving (1983) and Sentimental Journey (1984). He died on December 26, 2005 in New York City, New York.",https://www.imdb.com/name/nm0045987/bio
"Paolo De Vita was born on June 29, 1957 in Bari, Puglia, Italy. He is an actor and director, known for Anonymous (2011), To Rome With Love (2012) and Nebbie e delitti (2005).",https://www.imdb.com/name/nm0212204/bio
"Greg Hetson was born on June 29, 1960 in Brooklyn, New York, USA. He is an actor, known for Repo Man (1984), Pathology (2008) and Sid and Nancy (1986). He has been married to Alia since 2011.",https://www.imdb.com/name/nm0381769/bio
"Little Eva was born on June 29, 1943 in Belhaven, North Carolina, USA as Eva Narcissus Boyd. She was married to James Harris. She died on April 10, 2003 in Kinston, North Carolina.",https://www.imdb.com/name/nm3059037/bio
"Rebecca Jobson was born on June 29, 1989 in Wollongong, New South Wales, Australia as Rebecca Lea Jobson.",https://www.imdb.com/name/nm0423427/bio
"Aundrea Fimbres was born on June 29, 1983 in Upland, California, USA as Aundrea Aurora Fimbres. She is an actress, known for So You Think You Can Dance (2005), Danity Kane: Damaged (2008) and Making the Band 4 (2007).",https://www.imdb.com/name/nm2127747/bio
"Tom Fleming was born on June 29, 1927 in Edinburgh, Scotland as Thomas Kelman Fleming. He was an actor, known for King Lear (1970), Jesus of Nazareth (1956) and An Age of Kings (1960). He died on April 18, 2010 in Edinburgh.",https://www.imdb.com/name/nm0281801/bio
"Nicole Lauwaert was born on June 29, 1950 in Mechelen, Belgium. She is an actress, known for Aspe (2004), Nonkel Jef (1995) and Slisse & Cesar (1996).",https://www.imdb.com/name/nm0491641/bio
"John D. Voelker was born on June 29, 1903 in Ishpeming, Michigan, USA as John Donaldson Voelker. He is known for his work on Anatomy of a Murder (1959), The Amorous Dentist (1983) and Small World (1958). He died on March 18, 1991 in Marquette, Michigan.",https://www.imdb.com/name/nm0871261/bio
"Shail Chaturvedi was born on June 29, 1936 in Amravati, Bombay Presidency, British India. He is known for his work on Naya Zaher (1991), Hum Farishte Nahin (1988) and Agent Vinod (1977). He was married to Daya. He died on October 29, 2007 in Malad, Maharashtra, India.",https://www.imdb.com/name/nm0154220/bio
"Zsigmond Móricz was born on June 29, 1879 in Tiszacsécse, Austria-Hungary. He was a writer, known for Sárga rózsa (1941), Légy jó mindhalálig (1936) and Kerek Ferkó (1943). He was married to Mária Simonyi and Eugénia 'Janka Holics. He died on September 4, 1942 in Budapest, Hungary.",https://www.imdb.com/name/nm0617818/bio
"Tom Cohen was born on June 29, 1970 in Connecticut, USA. He is a producer and writer, known for Ca$h Cab (2005), Who Wants to Be a Millionaire (2002) and Stu (2020).",https://www.imdb.com/name/nm1458246/bio
"Born in 1972 this Czech actor studied at the Brno Academy of Dramatic Arts before joining the Hadivadla theatre company. His movie debut dates back to 1999 when Sasa Gedeon gave him the lead role in his 1999 ""Návrat idiota"" (Le retour de l'idiot). Twice nominated for the Best Actor Czech Lion, he won one for his role of Tonik, the lover who comes of age in the sensitive chronicle signed in 1995 by Bohdan Sláma's ""Stestí""(Something Like Happiness).",https://www.imdb.com/name/nm0514090/bio
"Henry Leroy-Salta was born on June 29, 1991 in Epsom, Surrey, England. He is an actor and director, known for The Yellow Birds (2017), Wolf Alice: Blush (2013) and Stationary (2015).",https://www.imdb.com/name/nm7380350/bio
"Born in Chicago on June 29, 1964, Bradley Phillip Bell is one of three children born to legendary television pioneers, Lee Phillip Bell, an Emmy Award-winning broadcast journalist and talk show personality, and the late Emmy Award- winning William J. Bell who created of the most popular daytime dramas ever. After graduating from the Chicago Latin School, Bradley Bell attended the University of Colorado at Boulder, the University of Wisconsin at Madison, and concluded his studies at UCLA, majoring in television production.Beginning in 1984 Bradley Bell started his career in writing. Taught by his father and serving as an unofficial member of the writing staff of The Young and the Restless (1973) writing breakdowns and scripts, Bell was integral in the creation and launch of The Bold and the Beautiful (1987). After serving on the writing team since the first episode, Bell was promoted to associate producer in 1989 and again to supervising producer in 1992. He took the reins from his father and became head writer in 1993 - after an extended 6-month trial co-written by his dad in 1992 - and then executive producer in 1995. He has remained in those positions ever since - amassing to one of the longest tenures in television. It wasn't until 2000 that Bradley Bell received his first Daytime Emmy Award nomination. By 2015, he has been awarded with three Emmys (2010, 2013, 2015) for his writing amongst 11 nominations and took home three statues for helming the Best Drama Series in a record three consecutive years (2009, 2010, 2011) amongst 9 nominations in addition to two Emmy wins in other categories.Under Bell's leadership, The Bold And The Beautiful vaulted from the sixth-rated daytime drama to the third-ranked series during the 1992-1993 season. Today, the show is firmly established as the second-highest-ranked daytime serial only behind its sister show The Young and the Restless in the United States amassing now-stable viewership numbers of around 4 million viewers every day. The show continues to be a worldwide phenomenon in such diverse markets as Italy, Australia or South Africa. Bell has continued with his father's tradition of story-telling whilst adding an edge and glamor to his show as writer and kept an extremely stable production and behind-the-scenes-staff resulting in a stunning 21st century look with regular locations shoots (around the globe) and permanent outdoors sets on the studio-lot on a very much stream-lined filming schedule. On January 14, 2015 CBS Television City, celebrating 7000 episodes of The Bold and The Beautiful, dedicated Studio 31 - home of the show since it's inception in 1987 - to Bell in honor of his work.Bell has been married to fellow Chicagoan Colleen Bell since October 1991, and is the proud father of Bradley Chasen, Caroline Catherine, Charlotte Cordelia and Oliver Phillip.",https://www.imdb.com/name/nm0068074/bio
"Sean Berry was born on June 29, 1992 in Eastbourne, England. He is an actor, director and screenwriter known for his roles in 'Eva' (2019), 'Love Sarah' (2020) and 'The Fishing Trip' (2020).Sean has appeared on stage and screen, and has undertook training at Act'in Theatre and Identity School of Acting.",https://www.imdb.com/name/nm10418577/bio
"Austin Drage was born on June 29, 1986 in Leytonstone, London, England as Austin Leigh Drage.",https://www.imdb.com/name/nm0236674/bio
"Anna Trokán was born on June 29, 1984 in Budapest, Hungary. She is an actress, known for Hercules (2014), Szeretföld (2017) and Lajkó - Cigány az ürben (2018).",https://www.imdb.com/name/nm2989447/bio
"Yûji Makiguchi was born on June 29, 1936 in Tokyo, Japan. He is a director and assistant director, known for Rashamen (1977), The Yakuza Code Still Lives (1976) and Shadow Warriors (1980).",https://www.imdb.com/name/nm1371352/bio
"Kirsi Ylijoki was born on June 29, 1969 in Rauma, Finland as Kirsi-Marja Ylijoki. She is an actress, known for Sydän toivoa täynnä (1997), Headhunters (2004) and Black Ice (2007). She has been married to Eicca Toppinen since 1997. They have two children.",https://www.imdb.com/name/nm0948215/bio
"Tighe Swanson was born on June 29, 1976 in Perth Amboy, New Jersey, USA. He is known for his work on My Teacher's Wife (1999), Poster Boy (2004) and Grand Theft Auto: Episodes from Liberty City (2009).",https://www.imdb.com/name/nm0841880/bio
"Paula Peralejo was born on June 29, 1984 in the Philippines as Maria Elena Paula Bautista Peralejo. She is an actress, known for Ang TV Movie: The Adarna Adventure (1996), Sarah... ang munting prinsesa (1995) and Eskapo (1995).",https://www.imdb.com/name/nm0672716/bio
"Scott Hinds was born on June 29, 1974 in England as Scott David Hinds. He is known for his work on Dracula Untold (2014), The Art of Resurrection and Afraid of the Dark (2012).",https://www.imdb.com/name/nm1446717/bio
"Dan Dierdorf was born on June 29, 1949 in Canton, Ohio, USA as Daniel Lee Dierdorf. He is an actor, known for Jerry Maguire (1996), Stuckey's Last Stand (1980) and Life Goes On (1989). He has been married to Debbie Grzywacz since November 2, 1979. They have three children.",https://www.imdb.com/name/nm0226090/bio
"Erin Howie was born in Norwood, Massachusetts. She knew she wanted to be an actress when she was three and would dance around in her underwear while her parents sang ""Here's to Erin and the Way She Does the Hula."" They would say ""Oh, what a little actress!"" Though Erin didn't know what ""actress"" meant at the time, she knew that whatever it was, she wanted to be one if it got her this much attention love and praise. Howie graduated from Boston University in 2000 with a bachelor's degree in broadcast journalism. While at school, Howie studied theater on the sly. Howie moved out to Los Angeles in 2002, hoping to become a film and television actress. She had every job (selling cars, working as a bank teller, bartending, selling pharmaceuticals...) until she landed a guest starring role on Desperate Housewives in 2006. This led to other roles, including playing a zombie in Mindfire Entertainment's Dead and Deader. Howie's character, Liberty, turns into a zombie, eats the bartender and gets shot by Dean Cain in the movie.",https://www.imdb.com/name/nm1676341/bio
"Marion Vernoux was born on June 29, 1966 in Montreuil, Seine-Saint-Denis, France. She is a director and writer, known for Empty Days (1999), Personne ne m'aime (1994) and Raw (2016).",https://www.imdb.com/name/nm0894742/bio
"Mark Radcliffe was born on June 29, 1958 in Bolton, Lancashire, England. He is an actor and director, known for Pulp Video (1995), Football Nightmares (2004) and Ideal (2005). He has been married to Bella Sharp since 1997. They have three children.",https://www.imdb.com/name/nm1034207/bio
"Barbara Avedon was born on June 29, 1930 in New York, USA. She is known for her work on Cagney & Lacey (1981), Screen Directors Playhouse (1955) and Fish (1977). She died on August 31, 1994 in Los Angeles, California, USA.",https://www.imdb.com/name/nm0042853/bio
"Fred Robsahm was born on June 29, 1943 in Lillesand, Aust-Agder, Norway as Frederik Otto Robsahm. He was an actor, known for Nel giorno del signore (1970), Young Lucrezia (1974) and Sins of Youth (1975). He was married to Agostina Belli. He died on March 26, 2015 in Lillesand.",https://www.imdb.com/name/nm0311147/bio
"The character of boy scout Jim Morgan in Gamera vs. Viras (1968) was then 11-year old Carl Craig's only acting job, but even though he had no ambition of becoming an actor, he nevertheless became a celebrity to friends and fellow children in Japan. He later became a US Air Force pilot (which he dreamed of becoming), and later, a US Customs Service pilot. He was also an advisor on the staff of then U.S. President George Bush. But of course, Carl still fondly remembers his one acting role to this day, and is kind enough to share his memories of the film with his many fans.",https://www.imdb.com/name/nm1342123/bio
"Katy Lamont was born on June 29, 1984 as Katherine Lamont. She is an actress, known for Brookside (1982), New Voices (1991) and Children's Ward (1989).",https://www.imdb.com/name/nm0483667/bio
"Caren Graham was born on June 29, 1955 in Los Angeles, California, USA as Caren Lynn Graham. She is an actress, known for Wee Sing in Sillyville (1989), Claire of the Moon (1992) and Metaltech: Earthsiege (1994).",https://www.imdb.com/name/nm0333954/bio
"Mitchel Evans was born on June 29, 1950 in Los Angeles, California, USA. He is an actor, known for Bram Stoker's Dracula (1992), The Suite Life of Zack & Cody (2005) and The Incredible Shrinking Woman (1981).",https://www.imdb.com/name/nm0263079/bio
"Theo Fleury was born on June 29, 1968 in Oxbow, Saskatchewan, Canada as Theoren Wallace Fleury. He is known for his work on Victor Walk (2016), Fleury and Score: A Hockey Musical (2010). He has been married to Jennifer since August 19, 2006. He was previously married to Veronica Hogartt.",https://www.imdb.com/name/nm0282231/bio
"Lloyd Richards was born on June 29, 1919 in Toronto, Ontario, Canada as Lloyd George Richards. He was a director and actor, known for American Playhouse (1980), The Wide World of Mystery (1973) and The Piano Lesson (1995). He was married to Barbara Davenport. He died on June 29, 2006 in New York City, New York, USA.",https://www.imdb.com/name/nm0724219/bio
"Milt Josefsberg was born on June 29, 1911 in New York, USA. He is known for his work on All in the Family (1971), The Lucy Show (1962) and The Jack Benny Program (1950). He died on December 14, 1987 in Burbank, California, USA.",https://www.imdb.com/name/nm0430503/bio
"While born in St. Louis, Missouri she was raised in Hollywood by her father silent movie actor Wilbur Higby and her mother who was in real estate. She worked on most of the network radio shows in Hollywood through the 1930s. Miss Higby then moved to New York where she appeared on nearly 50 (radio) soap operas and starred on 'When a Girl Marries' for 18 years. The show had the highest audience of any daytime serial; 7,000,000 listeners, for five years.",https://www.imdb.com/name/nm0383275/bio
"Mónica Estarreado was born on June 29, 1975 in Madrid, Spain. She is an actress, known for La Reina del Sur (2011), Al salir de clase (1997) and More Than a Thousand Cameras Are Working for Your Safety (2003). She has been married to Luis Arribas de la Cruz since September 2007. They have one child.",https://www.imdb.com/name/nm0261477/bio
"Nils Croné was born on June 29, 1990 in Göteborg, Sweden. He is known for his work on Emily and the Magical Journey (2020), King of Atlantis (2019) and Nothing is Lost (2019).",https://www.imdb.com/name/nm2758677/bio
"Kim Barnard was born on June 29, 1976 in Texas, USA. She is known for her work on Palm Springs (2020), Sylvie's Love (2020) and Robert the Bruce (2019).",https://www.imdb.com/name/nm2666912/bio
"Patrick Joseph Nicolas, the first of four children from his mother's side, he was born on June 29, 1984 in Miami FL in the neighborhood of Little Haiti. He is the son of Claire Michaud, a nurse, and Patrick Nicolas. Although born in Miami, Patrick spent his first nine years growing up in Port-au-Prince, Haiti, and was raised by his great grandmother along with his sister Claire. Patrick would spend most of his time watching all sorts of American films that would later inspire him to act, including his favorite TV show, MacGyver.In 1994 Patrick and his sister Claire moved back to the U.S. to live with their mother, father and two other siblings, Joshua and Elijah in Houston TX. Determined to play the dramatic roles he loved watching as a child, Patrick began his acting training and performing in short dramatic films.In college Patrick performed with the prestigious Houston theater company and starred in a very well received production of the Thornton Wilder's classic, ""Our Town.""Determined to take his career to the next level, Patrick took the little money he had, quit his job, and drove straight to Los Angeles. He amassed and starred in a list of independent films as well as ""Troubled Child"" (The Boarder). A film inspired by true-life events where Patrick (Jarren Williams) and his family attempt to cope with an adopted child suffering from Reactive Attachment Disorder. The movie aired on the lifetime movie network and won several independent awards.Patrick can also be seen in ""Shot"" (2017) where he plays the role of a man in group therapy suffering the lost of his sister who was killed by gun violence.He currently resides in Los Angeles.",https://www.imdb.com/name/nm3241009/bio
