"Brian Johnson is a award winning special and visual effects designer and director who for over 40 years provided his services to a multitude of film and television productions.Johnson's career began in 1957 when he joined Anglo Scottish Pictures after meeting veteran effects artist and skilled matte painter Les Bowie moving on to become a clapper loader and filming effects plates for Dunkirk (1958). After becoming a Hammer films effects assistant in 1958 Johnson's national service in the RAF followed before moving on to film the 1961 apocalyptic classic The Day the Earth Caught Fire during which he was an effects assistant at Bowie Films.In 1961 Johnson joined AP Films (later Century 21) under the talented Derek Meddings, firstly as a model builder and flyer on Gerry Anderson classics such as Supercar, Fireball XL5, Stingray and later a second unit director on the groundbreaking television series Thunderbirds. By 1966 Johnson left Century 21, taking with him a wealth of knowledge and found himself working on a Stanley Kubrick picture called 2001: A Space Odyssey on special effects shots which took over two years to complete. 2001 of course went on to become a huge success and to this day remains one of the most influential and highly regarded pictures of the science fiction genre.After 2001 film, Johnson went on to work on various film and television productions including Moon Zero Two, On the Buses, Z Cars, and the Hammer production When Dinosaurs Ruled the World with renowned stop motion animator Jim Danforth who was nominated for the Academy Award for Best Visual Effects. By 1974 Johnson was once again working for Gerry Anderson on his latest television series Space: 1999 producing high quality effects which are still highly regarded today, he was also responsible for designing the now iconic Eagle Transporter and various other craft of the series. It was during the production of 1999 at Bray Studios Johnson was first approached by two filmmakers to work on a big American space picture turning them down as he had signed for the second series of Space: 1999.Johnson's next big production was to be Ridley Scott's Alien where he once again worked with friend and Space: 1999 collaborator Nick Allder on the various model miniature effects sequences out of Bray Studios as special effects supervisor. Meanwhile the American Space picture became Star Wars, the highest grossing film of all time, an Academy Award winner and a cult worldwide phenomenon, the two aforementioned filmmakers were George Lucas and Gary Kurtz. Fortunately for Johnson he was invited to work on the sequel The Empire Strikes Back where he supervised special and visual effects at the now world renowned Industrial Light and Magic.In early 1980 Johnson's work on Alien was recognized when he was bestowed the 1979 Academy Award for Best Visual Effects along with H.R. Giger, Carlo Rambaldi, Nick Allder and Dennis Ayling. Just after this The Empire Strikes Back was released to worldwide acclaim and the 1980 Special Achievement Academy Award was presented to Brian Jonhson, Richard Edlund, Dennis Muren and Bruce Nicholson in recognition of their achievements in the field of visual effects.Johnson went on to work on Dragonslayer, at the request of Lucas and Spielberg and was nominated for another Academy Award, this time losing out to Raiders of the Lost Ark, this proved to be his final Lucasfilm production after which he worked on The NeverEnding Story and James Cameron's Aliens for which he was awarded a BAFTA for his contribution to visual effects.",https://www.imdb.com/name/nm0424644/bio
"Frank Loesser was born on June 29, 1910 in New York City, New York, USA as Frank Henry Loesser. He was married to Jo Sullivan and Lynn Garland. He died on July 28, 1969 in New York City.",https://www.imdb.com/name/nm0004230/bio
"Sophie Eloise Denver was born on June 29, 2003, in Mountain View, California. She was born to Romanian engineer, Christina Denver (leé Estel), and British-American accountant, Keith Denver. She was brought up in the Bay Area, and lived there until she was fourteen years old, when her family moved to Los Angeles.Her interest in Drama came very early on. Sophie played roles in theatre from Helen of Troy from ""Iliad and the Odyssey"", to Eponine Thenardiér in ""Les Misérables"". She embarked in classical training from prestige drama institutions in London, England, soon thereafter. It was not a surprise, that after praise and encouragement from her peers and tutors that she transferred her work to the silver-screen, finding ""[her] true passion."" Sophie Denver's first short and student films included award-winning Alexa Samaniego's Another Like, and Kaylin Endsley's artistic anthology called, The Youth Are Dancing (2019), among others.She found most early work in art-house and independent projects. At age sixteen, Sophie starred in Unseen Gardens (2020), a film by first-timer Stefan Cavillo. The beautiful, raw, short film chronicles her character, Vera, who struggles with the aftermath of her best friend Eiffel's death (who is played by Mina Gardi). During this time, she also wrapped a lead role by low-budget production group Amulet, in their cinematic debut, Emmaline (2020). In the extended short, Denver plays young Emma Brookmore, a girl who navigates her way through the 1920s; an auspicious connectivity of women's suffrage, the prohibition, and the jazz age. Both of the projects were pitched for film festivals.Shortly after turning seventeen, Sophie was cast in a small supporting role by Grammy-nominated DJ and brother of Spike Jonze, Sam I (A.K.A Sam Spiegel). This short filmed was called Heaven (2020). Alongside double Academy-Award nominee Catherine Keener, and the film's namesake & dancing extraordinaire Nevaeh Meraz, the film showcases Meraz's own experiences and love of dance. It was released in late October to great critical review and praise.",https://www.imdb.com/name/nm11166211/bio
"Frédéric Dard was born on June 29, 1921 in Bourgoin-Jallieu, Isère, France. He was a writer and director, known for Rendezvous (1960), Pensione Edelweiss (1959) and Le monte-charge (1962). He was married to Françoise de Caro and Odette Damaisin. He died on June 6, 2000 in Bonnefontaine, Fribourg, Switzerland.",https://www.imdb.com/name/nm0201063/bio
"Peter D. Greene was born on June 29, 1944 in the USA. He is an actor, known for Emergency! (1972), Mannix (1967) and Black Sheep Squadron (1976).",https://www.imdb.com/name/nm0338889/bio
"Jacqueline Taylor was born on June 29, 1925 in Compton, California, USA as Jacqueline Devon Taylor. She was an actress, known for Washee Ironee (1934), For Pete's Sake! (1934) and Shrimps for a Day (1934). She was married to Jack Fries and Ben Bard. She died on May 5, 2014 in Citrus Heights, California.",https://www.imdb.com/name/nm0528191/bio
"Ariadne Welter was born on June 29, 1930 in Mexico City, Distrito Federal, Mexico as Ariadna Gloria Welter Vorhauer. She is known for her work on Verano salvaje (1980), The Devil's Hand (1961) and Las mujeres panteras (1967). She was married to Miguel Gallego and Gustavo Alatriste. She died on December 13, 1998 in Mexico City.",https://www.imdb.com/name/nm0920628/bio
"Sarah Krasner was born on June 29, 1968 in England as Sarah-jane Drury. She is known for her work on Face/Off (1997) and Love Street (1994).",https://www.imdb.com/name/nm1478469/bio
"Monika Gruber was born on June 29, 1971 in Wartenberg, Erding, Bavaria, Germany. She is an actress and writer, known for München 7 (2004), Moni's Grill (2016) and Grünwald - Freitagscomedy (2003).",https://www.imdb.com/name/nm1128640/bio
"Mike Richardson was born on June 29, 1950 in Milwaukie, Oregon, USA as Michael Myron Richardson. He is a producer and writer, known for The Mask (1994), Timecop (1994) and Hellboy (2004).",https://www.imdb.com/name/nm0724700/bio
"Richard Anthony Crenna was born on June 29, 1959 in Los Angeles, California, USA. He is an actor, known for Predator 2 (1990), The Blob (1988) and The Glass House (2001).",https://www.imdb.com/name/nm0187388/bio
"Serena Deeb was born on June 29, 1986 in Oakton, Virginia, USA. She is an actress, known for WWE Smackdown! (1999), WWE NXT (2010) and WWE Superstars (2009).",https://www.imdb.com/name/nm3107661/bio
"Lucius Dillon was born on June 29, 1976 in the USA as Lucius Polk Dillon IV. He is known for his work on Mandie and Earring (2015), Killing Familiar and BachelorMan (2003).",https://www.imdb.com/name/nm1815577/bio
"You'd think with a last name like that, character player Andrew Tombes was doomed to play gravediggers in horrors or coroners in crime drama. Not usually, and when he did, it was often played for laughs. Born June 29, 1885 in Ohio, he was an athletic sort who played a lively, talented game of college baseball at Phillips-Exeter Academy but the dreams of entertaining quickly took over. As a performer he started things off in minstrels and musical revues, and appeared notably as a vaudevillian comic. Appearances in ""Flo-FLo (1908), The College Girls"" (1909), ""Miss 1917"" (1917) and ""Poor Little Ritz Girl"" (1920) led to the really big time for a comedian -- Ziegfeld. He slayed 'em as a star headliner in the Ziegfeld Follies in the 1920s, and played a wide range of squirrely parts in everything from Shakespeare to screwball farce. It was friend 'Will Rogers' from his old Follies days, who invited Tombes, at age 50, to settle in Hollywood as a prime featured performer in Rogers' film vehicle Doubting Thomas (1935). Thereafter at Fox he played the quintessentially bald, bemused and bug-eyed executive, professor, police captain, movie mogul or school administrator, but the parts got smaller and smaller. He went on to freelance in scores of featherweight ""B"" movies, often uncredited, mostly musicals and/or comedies. On the funereal side, he did play a dour undertaker's assistant in the Hope/Crosby vehicle Road to Morocco (1942) and a mortician in The Mad Ghoul (1943). True to form, his last movie role was in a comedy, the forgettable The Go-Getter (1956). He died about two decades later at the age of 90 in New York City.",https://www.imdb.com/name/nm0866558/bio
"Michael Phillips has been producing films and television in Hollywood since 1971. His films have garnered 23 Academy Award nominations, winning him a best picture Oscar for The Sting, a Palme d'Or Prize for Taxi Driver, and Italy's David di Donatello award for best picture for Clsoe Encounters of the Third Kind.Phillips graduated from Dartmouth college with an A.B. in History in 1965 and from NYU Law School with a Juris Doctor degree in 1968. He was admitted to the New York Bar in 1969. He serves as a Trustee Professor at Chapman University's Dodge College of Film & Media Arts, and has taught classes there on Cinema of the '70s, Science Fiction in cinema, and on the films of Akira Kurosawa.",https://www.imdb.com/name/nm0680635/bio
"John S. Davies was born in Regensburg, Germany, to Richard, an American diplomat and his wife Jean Davies. He grew up in American Embassies all over the world and in and around Washington, DC. He graduated San Jose State University in 1978 with a Bachelor's Degree in Theater and moved to Dallas, Texas, to pursue a Master of Fine Arts degree with the renowned Paul Baker at the Dallas Theater Center. Davies was awarded the MFA in June 1982 and has since pursued acting, directing and teaching careers. In addition to his extensive film and TV work, he has appeared in more than 60 professional theatre productions in roles ranging from Prospero in ""The Tempest"" to Willy Brandt in Michael Frayn's ""Democracy."" Davies also directs theatre-recent productions include ""Richard III: for Shakespeare Dallas and ""T Bone N Weasel"" for Circle Theatre Ft Worth. He is represented by the Kim Dawson Agency (214-638-2414) and teaches college-level acting at KD Actors Conservatory. He is married to the TV News Coach Lou Michaels and is the father of two sons Rees, 29, a professional guitarist and Kelley, 23, a free spirit.",https://www.imdb.com/name/nm0203788/bio
"Travis Richey is an actor/writer living in Hollywood, CA. He has recently appeared on TV in FOX's Sons of Tucson, NBC's The Event, and Lifetime's Seriously Funny Kids. He is also recurring on ABC Family's ""Pretty Little Liars"" as Harold Crane, and on NBC's ""Community"" as Inspector Spacetime, a role that launched him into the spotlight of Doctor Who fans.Travis had previously achieved international acclaim as the creator of several web series, including ""Robot, Ninja & Gay Guy"", ""2 Hot Guys In The Shower"", ""Smiley Town"", and an award-winning series of ""Mac vs PC"" spoofs.His videos have been seen on CNN, Comedy Central's website, The Huffington Post, The UK Telegraph, PerezHilton.com, and dozens of other notable blogs and websites across the internet, and have garnered over 3 million views. Travis also performs regularly at ACME Comedy Hollywood.",https://www.imdb.com/name/nm1770866/bio
"Michael Zenon was best known as the actor who played native guide, Joe Two Rivers, in the Canadian children's classic, ""The Forest Rangers"" from 1963-1965. He was born in the Ukraine but moved to Canada after WW2 with his family. After his acting career he went into the assistant director field and has been a part of many big films shot in Canada.",https://www.imdb.com/name/nm0954905/bio
"Joel Roberts was born on June 29, 1991 in Washington D.C., USA. He is an actor, known for Life Risking Romance (2016), A Melody to Remember (2016) and The Tooth and the Nail (2017).",https://www.imdb.com/name/nm10353488/bio
"Sofie Formica was born on June 29, 1971 in Brisbane, Queensland, Australia. She is known for her work on San Andreas (2015), First Strike (1996) and Home and Away (1988).",https://www.imdb.com/name/nm0286422/bio
"Kirsten Lea was born in London, England and is the daughter of Charlie Lea, who produced and managed actor Anthony Newley, husband of actress Joan Collins.Kirsten was brought up immersed in the acting profession and first appeared on stage at the tender age of four, when her father invited her to tread the boards of the world famous stage at the London Palladium, where he worked as a producer.Kirsten began taking classes in performing arts from the age of four, and was consequently cast in the lead roles in plays as soon as she began attending preparatory school. Throughout her teens, she continued to win the lead roles in plays such as Romeo & Juliet, Great Expectations, A Midsummer's Night Dream and Wuthering Heights. She twice won awards for Best Actress at her local theatre school and later went on to teach children Dance and Drama at the Theatre Train School in London.After her father's death when she was just sixteen, she chose not to attend a formal drama school, despite winning a scholarship to one. Instead she continued to take private tuition under a range of dance, drama and music coaches while earning a degree in Art History and Journalism. After passing her examinations with distinctions, Kirsten worked for several magazines including Harpers & Queen and had regular features published in magazines such as Company, Women's Health, Total Style, Ms London, Girl About Town and The Magazine Guide. She also wrote a monthly fashion column for British newspaper, The Union Jack, published across America, while also appearing as a model and cover girl for numerous other publications.Kirsten began writing screenplays in her early twenties and finally turned her hand to production, when she produced a million pound Variety Theatre Show in honor of her late father, in place of her own wedding reception. The show featured family show business friends such as comedian Jimmy Tarbuck, Mind Reader Graham P. Jolley and Grammy-Nominated Jazz Pianist Jamie Cullum. Kirsten also hosted the show.Continuing her intensive study of acting with private drama teachers in England throughout her early twenties, it was while attending a master class at the London Academy of Film that Kirsten came to the attention of renowned director and acting coach Milfid Ellis, who has described Kirsten as ""having a real gift"". Milfid has since supported Kirsten in both the classroom and on location.In early 2008, Kirsten made a highly publicized appearance at both the Spirit Awards for Independent Film and the 80th Annual Academy Awards ® where she was one of 'the most photographed stars on the red carpet'. She then went on to make her feature film debut in the highly anticipated production of _The Soloist (2008)_directed by 'Joe Wright'( Atonement (2007), Pride & Prejudice (2005)), where she starred alongside Robert Downey Jr..Combining her passion for acting and producing, Kirsten launched her own production company, LoveLea Films, with branches in London and Los Angeles where she divides her time.",https://www.imdb.com/name/nm2875873/bio
"This pretty, blonde 1940s B-movie starlet was the daughter of newspaperman Leonard Sanders and showgirl Blanche Thompson (who also appeared in a few silent pictures). By her own account, she was born in Hollywood as Nancy Lou Sanders on June 29 1925, the day of the Santa Barbara earthquake. Curiously, being in the movies had not been her primary career choice when she was spotted dancing at the Cocoanut Grove nightclub by journeyman actor and talent scout Don Dillaway. Dillaway took an instant shine to Nancy and managed to arrange a screen test at RKO. She passed muster and was rewarded with a six-month contract (being an experienced equestrian from the age of eight also helped clinch the deal). Before long, she found herself on the cover of Life magazine -- along with Jane Greer and Martha Hyer -- as one of 'nine hopefuls'. After five pictures, RKO dropped her option and Nancy moved over to Columbia where she went on to appear in no less than thirteen pictures in 1947 alone. Many of these were horse operas, including half a dozen of the Durango Kid series with Charles Starrett, shot at the Columbia ranch in Burbank. Nancy also doubled for Rita Hayworth in The Lady from Shanghai (1947) (wearing a blonde wig) and The Loves of Carmen (1948) (dressed as a gypsy). She was Gerald Mohr's leading lady in The Lone Wolf in London (1947) and popped up in a few Three Stooges comedies which she later said to have really enjoyed being in. When her Hollywood career began to falter in the early 50s, Nancy found work as a tour booking agent with Air Cal Airlines. In 1996, she came out of retirement for occasional TV guest appearances. She was predeceased by her husband of 43 years, a sales rep for Seagram and Jim Bean.",https://www.imdb.com/name/nm0766912/bio
"Mark Kriski's charismatic approach, quirky sidebar comments and hilarious observations keep ""KTLA Morning News"" viewers tuning in day after day. Yet, when Mother Nature darkens the skies of Southern California, Kriski's weather knowledge and expertise shine through, placing him at the top of his field. With 8 Emmy Awards under his belt for his coverage of everything from the Malibu fires to the Northridge earthquake, Mark is Los Angeles' most popular weatherman.A native of Montreal, Canada, Kriski studied radio and television arts at Fanshaw College in London, Ontario. Mark longed to be in television but worked his way up in radio first. He performed commercial voice-overs, become a radio disc jockey and soon graduated to promotion director. An experienced broadcaster, ready to pursue his dreams, Mark landed his first job in front of the cameras as a 'weather caster' on Canada's Weather Channel.""KTLA Morning News"" made Mark a great offer and the Los Angeles demographic was eminently appealing so Kriski accepted the position and took his first job in the United States. Los Angeles viewers enjoyed his unique style and related warmly to his talents. The L.A. Times named Kriski the Funniest Weatherman in Los Angeles and his dedication earned him 3 Golden Mike Awards for Best Weather Segment from the esteemed Radio & Television News Association.Besides his full-time position on ""KTLA's Morning News"" Mark has played newscasters in over 10 Hollywood Blockbuster movies and done segments for Business World News. Humbled by his good fortune and eager to give back, Mark is actively involved in community and charitable causes. Kriski supports the Union Rescue Mission and The Fire Fighters Association. He also participates in charity golf tournaments, Hollywood Stars Baseball Games and has served as Grand Marshall twice in Veterans Day and Christmas parades, earning him a Certificate of Appreciation from the City of Los Angeles.Kriski lives in the San Fernando Valley. He enjoys scuba diving, motorcycle riding, horseback riding, tennis, skiing & ice hockey.",https://www.imdb.com/name/nm0471505/bio
"Daniel Renteria was born on June 29, 1991 in Los Angeles, California, USA as Daniel Scott Renteria. He is an actor, known for Full House (1987).",https://www.imdb.com/name/nm0719856/bio
"Suzette Quintañilla was born on June 29, 1967 in Lake Jackson, Texas, USA. She is an actress and producer, known for Selena: The Series (2020), Untitled ABC/Selena Quintanilla Drama and Selena Live: The Last Concert (1995). She has been married to Bill Arriaga since 1993. They have one child.",https://www.imdb.com/name/nm1921527/bio
"Shô Nishino was born on June 29, 1989 in Shizuoka, Japan. She is known for her work on Shutter (2008).",https://www.imdb.com/name/nm2739561/bio
"Tajja Isen was born on June 29, 1991 in Toronto, Ontario, Canada. She is an actress, known for Atomic Betty (2004), Super Why! (2007) and The Berenstain Bears (2002).",https://www.imdb.com/name/nm1375384/bio
"Olga Mashnaya was born on June 29, 1964 in Leningrad, RSFSR, USSR as Olga Vladimirovna Mashnaya. She is an actress, known for Kin-dza-dza! (1986), Vsyo naoborot (1982) and Milyy, dorogoy, lyubimyy, edinstvennyy... (1985).",https://www.imdb.com/name/nm0556347/bio
"Beatriz Romilly was born on June 29, 1983 in Madrid, Spain. She is known for her work on Doctor Faustus (2012), The Green Green Grass (2005) and The Bill (1984).",https://www.imdb.com/name/nm2440232/bio
"Greg Burson was born on June 29, 1949 in Los Angeles, California, USA as Gregory Lewis Burson. He is known for his work on Jurassic Park (1993), Samurai Jack (2001) and Mr. Magoo (1997). He died on July 22, 2008 in Los Angeles.",https://www.imdb.com/name/nm0123354/bio
"Guy McElwaine was born on June 29, 1936 in Culver City, California, USA as Guy Franklin McElwaine. He was a producer, known for Man of the Year (2006), Exorcist: The Beginning (2004) and The Good Shepherd (2006). He was married to Leigh Taylor-Young, Sheila Stubbs O'Neal, Michele Schwab, Pamela Austin, Bonnie J. Morse and Norma J. Edwards. He died on April 2, 2008 in Los Angeles, California.",https://www.imdb.com/name/nm0568476/bio
"Although born in Chicago, Illinois, Jeff Coopwood grew up in Miami, Florida. While obtaining a Bachelor of Fine Arts from the University of Miami, he sang for four seasons with the Miami Opera. Upon graduation, he toured across the country in the Broadway National tour of ""Timbuktu!"" starring Eartha Kitt and also starred in several stage productions throughout the United States and Canada. He went on to teach, coach and lecture in speech and debate at various high schools and colleges across the country, including Harvard, Northwestern, Georgetown, Marquette, and Emory Universities, as well as the Universities of Pennsylvania and Miami. Upon his return to Chicago, he was the Emmy-nominated host of the '$100,000 Fortune Hunt' and also hosted 'Know Your Heritage', both nationally syndicated television game shows. Upon moving to Los Angeles, he become known for his proficiency with accents, dialects and vocal imitations and received an Emmy nomination for his voice-over work. He is a member of the Academy of Television Arts & Sciences and earned a Master of Arts in Humanities from the California State University, Dominguez Hills. His career has included television, film, commercials, voice-overs, video games, theatre, opera and broadcasting.",https://www.imdb.com/name/nm0178494/bio
"Robert Frazer was born on June 29, 1891 in Worcester, Massachusetts, USA as Robert William Browne. He was an actor, known for Two-Gun Caballero (1931), The Vampire Bat (1933) and The Fighting Parson (1933). He was married to Mildred Bright. He died on August 17, 1944 in Los Angeles, California, USA.",https://www.imdb.com/name/nm0292537/bio
"Michael D. Fuller was born on June 29, 1981 in Columbia, South Carolina, USA. He is a producer and writer, known for Quarry (2016), Locke & Key (2020) and Rectify (2013).",https://www.imdb.com/name/nm1331637/bio
"Paul Newlan was born on June 29, 1903 in Plattsmouth, Nebraska, USA as Paul Emory Newland. He was an actor, known for Down Rio Grande Way (1942), Dragnet (1947) and M Squad (1957). He was married to Hazel Bokarney Newlan. He died on November 23, 1973 in Studio City, California, USA.",https://www.imdb.com/name/nm0627945/bio
"Chieko Baishô was born on June 29, 1941 in Tokyo, Japan. She is an actress, known for Howl's Moving Castle (2004), Tora-san's Runaway (1970) and Tora-san's Rise and Fall (1975). She has been married to Reijiro Koroku since 1993. She was previously married to Mamoru Komiya.",https://www.imdb.com/name/nm0047962/bio
"Samantha Smith was born on June 29, 1972 in Houlton, Maine, USA as Samantha Reed Smith. She was an actress, known for Lime Street (1985), Charles in Charge (1984) and The Tonight Show Starring Johnny Carson (1962). She died on August 25, 1985 in Auburn, Maine.",https://www.imdb.com/name/nm0809858/bio
"Tom Butcher was born on June 29, 1963 in England. He is an actor, known for The Bill (1984), When Did You Last See Your Father? (2007) and Doctors (2000). He has been married to Corrinne Wicks since November 2005.",https://www.imdb.com/name/nm0124719/bio
