"The only career Nelson Eddy ever considered was singing. His parents were singers, his grandparents were musicians. Unable to afford a teacher, he learned by imitating opera recordings. At age 14 he worked as a telephone operator in a Philadelphia iron foundry. He sold newspaper advertising and performed in amateur musicals. Dr. Edouard Lippe coached him and loaned him the money to study in Dresden and Paris. He gave his first concert recital in 1928 in Philadelphia. In 1933 he did 18 encores for an audience that included an assistant to MGM studio chief Louis B. Mayer, who signed him to a seven-year contract. After MGM acting lessons and initial trials, his first real success came as the Yankee scout to Jeanette MacDonald's French princess in Naughty Marietta (1935), a huge box-office success made on a small budget. Eddy and MacDonald were paired twice more (Rose-Marie (1936), Maytime (1937)) when Metropolitan Opera star Grace Moore was unavailable; they became an institution. Their last work together was in 1942. Critics nearly always panned his acting. He did have a large radio following (his theme song: ""Short'nin Bread""). In 1959 Eddy and MacDonald issued a recording of their movie hits which sold well. In 1953 he had a fairly successful nightclub routine with Gale Sherwood which ran until his death in 1967. He and his wife Anne Denitz had no children.",https://www.imdb.com/name/nm0248904/bio
"Maurice Kaufmann was born on June 29, 1927 in Gorleston, Norfolk, England as Maurice Harington Kaufmann. He was an actor, known for Gorgo (1961), Die! Die! My Darling! (1965) and The Hero (1970). He was married to Honor Blackman. He died on September 21, 1997 in London, England.",https://www.imdb.com/name/nm0442332/bio
"Shenaz Treasurywala was born on June 29, 1981 in Bombay, Maharashtra, India. She is the daughter of a Merchant Navy captain and spent the first seven years of her life traveling the globe on board cargo ships carrying potatoes, onions and rice. After completing her school she enrolled in St. Xavier's College. It was during her first year in this college that she was discovered by a photographer. She started her career as a model and has appeared in TV commercials like Gold Spot, Philips, Trigger Jeans, Akai, Elle 18, and many more. She then started working as a Veejay for MTV.In 2001, Shenaz moved to New York, USA, to enroll in the Lee Strasberg Theater & Film Institute, as well as taking a writing course at New York University. She was thrilled to complete this 8 month course in the same school as Al Pacino and Robert De Niro. She made quite a dramatic entry into Bollywood after she lost her luggage, passport and visa papers while traveling by Kuwait Airways, and as result was unable to return to New York. This incident proved to be an advantage as she was approached by Ken Ghosh, who signed her up for a role in Ishq Vishk (2003). She was nominated for the Filmfare Awards for ""Ishq Vishk"", which went on to be a huge Asia-wide box office phenomenon. She has since then acted in a total of several other movies.Her hobbies include photography, playing the piano, travel, scuba, surfing, dancing, horseback riding, writing, and this natural beauty, with a dimpled and toothy smile atop curved lips, is ranked amongst the 'Top 100 Beautiful Women.' Quite versatile as she is an actress, writer, TV presenter, VJ, travel junkie, and nature lover. She is also host on Travel Channel's Culture Shock (2007), and has written travel articles in magazines which include Cosmopolitan, Femina, and Elle. Shenaz became a household name on MTV Asia at a very young age. Her most popular show, MTV's Most Wanted (1992) was the highest rated show on MTV for years and MTV often jokingly complained they had no space for her fan mail. She was on MTV Asia for 8 years hosting every show, based in Hong Kong, Singapore and Mumbai.After this phenomenal success of ""Ishq Vishk"", Shenaz left India for Hong Kong to act in a comedy show called MTV Whatever Things (2003), which was the highest-rated show in South East Asia. Her dream series Culture Shock (2007), a quirky travel show was written, produced and hosted by her. It aired on the Discovery Travel Channel in the U.S. After ""Culture Shock"", Shenaz returned to India and hosted, The Great Indian Laughter Challenge (2005) on Star TV and the ""Unforgettable Tour"" (Bachchan World Tour) on NDTV Imagine. She played lead roles in Umar (2006), Aagey Se Right (2009) and Radio: Love on Air (2009). She played a lead character of Rama Patel in one of America's longest running soap operas, One Life to Live (1968). Both she and her character were household name amongst the soap watchers. This femme fatale developed a huge fan base in America and was regularly on the cover of all the soap magazines.Shenaz is also a screenplay writer and her first film, Luv Ka the End (2011) was produced by Yash Raj Films. She has also acted in Delhi Belly (2011) opposite Imran Khan which turned out to be the biggest hit of the year in India. It's been talked about as a cult film in which she plays a sassy sexy air hostess. Shenaz also acted in independent American films like The Networker (2015). In spring of 2015, she was a contributor in The Nightly Show with Larry Wilmore (2015). She resides in New York but does shuttle back and forth between the U.S. and India - depending on filming schedules - and calls herself 'Trans-Continental'.",https://www.imdb.com/name/nm1376654/bio
"John Kelly was born on June 29, 1901 in Boston, Massachusetts, USA as John F. Kelly. He is known for his work on Bringing Up Baby (1938), My Gal Sal (1942) and Three Sons o' Guns (1941). He died on December 9, 1947 in Los Angeles, California, USA.",https://www.imdb.com/name/nm0446503/bio
"Renée Fokker was born on June 29, 1961 in Nijmegen, Gelderland, Netherlands. She is an actress and writer, known for Blind Date (1996), Zwarte tulp (2015) and Paradise (1999).",https://www.imdb.com/name/nm0284036/bio
"Tony Vogel was born on June 29, 1942 in Oxfordshire, England. He was an actor, known for Indiana Jones and the Raiders of the Lost Ark (1981), Mission: Impossible (1996) and Les Misérables (1998). He died on July 27, 2015.",https://www.imdb.com/name/nm0900963/bio
"A dark, exotic beauty, Katherine DeMille was a fascinating screen presence in the 1930s and 1940s. She was born in Canada to a Scottish schoolteacher, Edward Gabriel Lester, and his Italian-Swiss wife, Cecile Bianca Bertha (Colani) Lester. Her father was killed in France during World War I, and her mother, who was terminally ill, traveled to California to find Katherine's paternal grandparents and leave her with them. Mrs. Lester died before she could contact her in-laws and Katherine was placed in a Los Angeles orphanage. Constance Adams, the wife of Hollywood's top filmmaker Cecil B. DeMille, was a director of the orphanage. The DeMilles were moved by Katherine's misfortune and decided to adopt her. She became a member of a family that also included the DeMilles' only natural child, Cecilia de Mille; another adopted child, John de Mille; and Richard de Mille, who was actually DeMille's nephew.Katherine was educated at the Hollywood School for Girls and the Santa Barbara School for Girls. She loved acting in school plays and eventually found work as a movie extra, using the stage name Kay Marsh. DeMille, aware of his daughter's dream of becoming a star, hired her as a script supervisor for his film Four Frightened People (1934) and permitted her to visit the sets of his films and watch his editing process. She secretly auditioned for the role of Pancho Villa's wife, Rosita Morales, in the MGM production Viva Villa! (1934), starring Wallace Beery in the title role. She won the role and impressed the critics with her performance and beauty. Her portrayal of a Mexican maid in The Trumpet Blows (1934) earned her a contract with Paramount Pictures, and she was cast as the villain in Mae West's Belle of the Nineties (1934). Her ability to succeed in films on her own helped her gain her father's admiration as well as a featured role in his next epic, The Crusades (1935). She played Alice, Princess of France, and competed with Loretta Young's Berengaria for the love (and title as consort) of Richard the Lionheart (Henry Wilcoxon). The critics appreciated Katherine's talent and appearance in the lavish DeMille production. Her career was ascending.After her excellent work in the prestigious DeMille picture, Katherine was finally elevated to leading lady status. Paramount starred her in Drift Fence (1936) and Sky Parade (1936). She was also loaned out to MGM for an uncredited appearance as Romeo's first love, Rosaline, in Romeo and Juliet (1936). 20th Century-Fox cast her in a supporting role in the Barbara Stanwyck-Joel McCrea starrer Banjo on My Knee (1936) and gave her second billing in Charlie Chan at the Olympics (1937). Katherine fell in love with Mexican actor Anthony Quinn and married him in 1937. She was billed third in The Californian (1937) and appeared in Love Under Fire (1937), a Spanish Civil War drama. At Columbia Pictures, she was billed second in the Jack Holt vehicle Under Suspicion (1937). This was followed by a small role in another Spanish Civil War drama, Blockade (1938), and a leading lady role in another Jack Holt vehicle, Trapped in the Sky (1939). Unfortunately, the big studios failed to showcase her talent in notable productions. Her next roles were featured in B movies: In Old Caliente (1939), Isle of Destiny (1940), Ellery Queen, Master Detective (1940), and Dark Streets of Cairo (1940). She returned to Paramount for a role in the Technicolor film Aloma of the South Seas (1941).The Quinns had five children. She abandoned her film career after the tragic death of their firstborn, Christopher, in 1941. She made a comeback with a leading role in Black Gold (1947), co-starring her husband, and a supporting role as a Native American woman in her father's Unconquered (1947). She also starred in the film noir The Judge (1949). The Quinns divorced in 1965, and Katherine later moved to Tucson, Arizona, where she died of Alzheimer's disease in 1995.",https://www.imdb.com/name/nm0218490/bio
"Widely popular comedienne appeared in some movies and on radio in the 40s and on early television. She starred in the popular television series, I Married Joan (1952), with Jim Backus as her husband and her real-life daughter, Beverly Wills as her sister.Joan died of a sudden heart attack in 1961. Two years later, a fire tragically claimed the lives of her mother, daughter and two grandsons.",https://www.imdb.com/name/nm0204843/bio
"Jill-Michele Meleán was born and raised in Miami, FL to an Irish Mother and South American Father. She was the first and only Latina Cast member FOX's MADtv, recurred on Comedy Central's RENO 911 and she's a national touring stand up comedienne. Her roots are dramatic acting but she quickly learned her gift of comedy timing. AKA ""Jilly"", wrote, produced & stared in the indie film ""This is Meg"" based on her true life events.",https://www.imdb.com/name/nm0577549/bio
"Monica Allgeier was born on June 29, 1979 in Louisville, Kentucky, USA as Monica Rachelle Allgeier. She is an actress and producer, known for Veronica Mars (2004), Scrubs (2001) and Las Vegas (2003).",https://www.imdb.com/name/nm1179717/bio
"Michael Hagerty was born on June 29, 1971 in Torrance, California, USA. He is an actor and producer, known for Dark Skies (1996), Nash Bridges (1996) and Coyote.",https://www.imdb.com/name/nm0353548/bio
"James Patterson was born on June 29, 1932 in Derry, Pennsylvania, USA. He was an actor, known for In the Heat of the Night (1967), Silent Night, Bloody Night (1972) and The DuPont Show of the Week (1961). He was married to Rochelle Oliver. He died on August 19, 1972 in New York City, New York, USA.",https://www.imdb.com/name/nm0666247/bio
"Ed Gilbert was born on June 29, 1931 in Chicago, Illinois, USA as Edmund Francis Gilbert. He was an actor, known for The Transformers: The Movie (1986), TaleSpin (1990) and Johnny Got His Gun (1971). He died on May 8, 1999 in Beverly Hills, Los Angeles, California, USA.",https://www.imdb.com/name/nm0318027/bio
"Soren Fulton was born on June 29, 1991 in the USA as Soren Albert Fulton. He is an actor, known for Thunderbirds (2004), Saving Sarah Cain (2007) and Power Rangers Lightspeed Rescue (2000).",https://www.imdb.com/name/nm1002695/bio
"Tall, dark and regal Frieda Inescort's placid loveliness and dignified patrician features boded her well in Hollywood during the late 1930s and 1940s. Born on June 29, 1901 in Edinburgh, the Scots-born actress who began acting on stage, did not arrive in Hollywood until age 34 (then considered too late for leading lady roles) but managed to settle fairly comfortably on the supporting sidelines in chic melodramas and tearjerkers.Born Frieda Rowell Wightman, she was the daughter of Scots-born journalist John ""Jock"" Wightman and actress Elaine Inescourt, who was of German and Polish descent. Her parents initially met when her father came to review a play her mother was appearing in. They married in 1899 but eventually parted ways while Frieda was still young. Her impulsive mother, who had strong designs on a theater career and placed it high on her priority list, sent young Frieda off to live with other families and in boarding schools in England and Wales while she avidly pursued her dreams. Although her parents divorced in 1911, with her father charging her mother with abandonment and adultery, Frieda ended up moving to the United States with her mother. Again, when Elaine found occasional roles in touring shows, Frieda wound up being carted off to convents or boarding schools.Mother and daughter eventually returned to London following World War I, and the young girl, now solely on her own, managed to find employment as a personal secretary to British Member of Parliament Waldorf Astor (2nd Viscount Astor), who was then Parliamentary Secretary to Prime Minister David Lloyd George. She also assisted the American-born Lady Nancy Astor, the second woman elected to the UK House of Commons and the first to take her seat there. While accompanying Lady Astor on a trip to the United States in July 1919, Frieda decided to stay in the States and terminated her position with the Astors. In New York she continued finding secretarial work that supported both her and her unemployed-actress mother. She worked at one point with the British consulate in New York.Noticing a number of American actors cast in British parts on Broadway, Frieda was encouraged in the early 1920s to test the waters out, as British actresses were in short supply. By chance, she was introduced to producer-director Winthrop Ames, who gave the unseasoned hopeful a small but showy role in his Broadway comedy ""The Truth About Blayds"" (1922). The play turned out to be a hit. Playwright Philip Barry caught her stage performance and offered her a starring role in his upcoming comedy production ""You and I"". The show proved to be another winner and Frieda, a star on the horizon, finally saw the end of her days as part of a secretarial pool.For the rest of that decade, she alternated between stage comedy and drama and became a vital force on Broadway with prominent roles in ""The Woman on the Jury"" (1923), ""The Fake"" (1924), ""Hay Fever"" (1925), ""Mozart"" (1926), ""Trelawny of the Wells"" (1926) and ""Escape"" (1927). Frieda's happenstance into acting and her sudden surge of success purportedly triggered deep envy and jealousy within her mother, who was unemployed. This led to a bitter and long-term estrangement between the two that never managed to heal itself. (Elaine died in 1964.) While working in the late 1920s as an assistant at Putnam's Publishing Company in New York, Frieda met assistant editor Ben Ray Redman. They married in 1926 and Redman later became a literary critic for the New York Herald Tribune. Frieda, in the meantime, continued to resonate on the New York and touring stage with such plays as ""Springtime for Henry"" and ""When Ladies Meet"".For over a decade, Frieda had resisted the cinema, having turned down several offers in silent and early talking films. When her husband was offered a job with Universal Studios as a literary adviser and author, however, and the couple had to relocate to Hollywood, she decided to take a difference stance. Discovered by a talent scout while performing in a Los Angeles play, Frieda was signed by The Samuel Goldwyn Company and made her debut supporting Fredric March and Merle Oberon in the dewy-eyed drama The Dark Angel (1935), for which she received attractive notices and rare sympathy as the secretary of a blind author (played by March).She did not stay long at Goldwyn, however, and went on to freelance for various other studios. During the course of her movie career, Frieda could be quite charming on the screen playing a wronged woman (as she did in Give Me Your Heart (1936)), but she specialized in haughtier hearts and played them older and colder than she really was off-camera. She soon gained a classy reputation for both her benign and haughty sophisticates. After Warner Bros. signed her up, she showed promise in Another Dawn (1937), Call It a Day (1937) and The Great O'Malley (1937), all 1937 releases. After this, however, her studio lost interest in her career and loaned her out more and more to other studios. Some of these films were leads -- including the ""B""-level Woman Doctor (1939) opposite Henry Wilcoxon, A Woman Is the Judge (1939) with Otto Kruger, Shadows on the Stairs (1941) co-starring Paul Cavanagh, and, in particular, the title role in Portia on Trial (1937). For MGM she played the irrepressibly snobbish Caroline Bingley, who sets her sights on Darcy (Laurence Olivier) in the classic Jane Austen film adaptation of Pride and Prejudice (1940). Besides competing with (and losing out) to Greer Garson in that film, she played the ""other woman"" in Beauty for the Asking (1939), starring Lucille Ball.When her career started to lose steam, Frieda returned to New York and the Broadway stage with matronly parts in Soldier's Wife"" (1944), ""The Mermaids Singing"" (1945) and George Bernard Shaw's successful revival of ""You Never Can Tell"" (1948). After the tour of the Shaw play folded, she returned to Hollywood. Finding it difficult to pick up where she left off in films, Frieda focused on the relatively new medium of TV in the early 1950s. She appeared as Mrs. Archer on the Meet Corliss Archer (1950) series (based on the popular bobbysoxer's radio program) but was replaced by Irene Tedrow in its second and final season. She also graced a number of dramatic TV showcases. The films she made later that decade, including The She-Creature (1956), Senior Prom (1958), and Juke Box Rhythm (1959), were largely dismissed by the critics.While filming her last picture, The Crowded Sky (1960), for Warner Bros., Frieda began experiencing health problems. She was quickly diagnosed as having multiple sclerosis. By the next year, she was forced to retire and had to walk with the aid of a cane. Things got worse that year when her husband, who had grown despondent over personal and financial issues, committed suicide with an overdose of pills at their California home on August 2, 1961. By the mid-1960s, the former actress was virtually incapacitated and confined to a wheelchair but valiantly worked for the multiple sclerosis association when she could muster the strength. In 1973, she moved permanently into the Motion Picture Country Home in Woodland Hills, Los Angeles, where she died at age 74 on February 21, 1976.",https://www.imdb.com/name/nm0408586/bio
"Peter Jessop was born on June 29, 1964 in Natick, Massachusetts, USA. He is known for his work on Fallout 4 (2015), Resident Evil (2002) and Mass Effect (2007).",https://www.imdb.com/name/nm0422247/bio
"John Fujioka was born on June 29, 1925 in Olaa, Hawaii, USA. He was an actor, known for American Ninja (1985), Mortal Kombat (1995) and Pearl Harbor (2001). He died on December 13, 2018 in Los Angeles, California, USA.",https://www.imdb.com/name/nm0297801/bio
"Paolo Mastropietro was born on June 29, 1964 in New York City, New York, USA. He is an actor, known for Cradle 2 the Grave (2003), Exit Wounds (2001) and Renegade Force (1998). He has been married to Jill Hennessy since October 1, 2000. They have two children.",https://www.imdb.com/name/nm0557892/bio
"After studying for a teaching diploma at the Central School of Speech and Drama, Maureen O'Brien became a founding member of the Everyman Theatre in her native Liverpool. About three months later she was persuaded to audition for the part of Vicki on Doctor Who. She was reluctant to accept the role, but did so partly to be with her London-based boyfriend (later her husband). It was a decision she later regretted as, although she liked the people she worked with, she did not enjoy the job and the enormous publicity it brought her. After leaving Doctor Who she worked as a supply teacher at a girl's school in Kennington, then returned to the theatre. This was followed by a three-year spell in Canada. Since returning to the UK in the mid-seventies, she has had further success in theatre, TV, radio and film, and as a writer of crime fiction.",https://www.imdb.com/name/nm0639709/bio
"Yûki Morinaga was born on June 29, 1996 in Osaka, Japan. He is an actor, known for Alice in Borderland (2020), Chihayafuru Part I (2016) and Live (2014).",https://www.imdb.com/name/nm2473146/bio
"Colin Hay was born on June 29, 1953 in Kilwinning, Scotland as Colin James Hay. He has been married to Cecilia Nöel since 2002.",https://www.imdb.com/name/nm0370478/bio
"Kilbourne was only eighteen when she has appeared in television for the first time. It was March 1983, when she guest appeared in one of the Matt Houston (1982) episodes. She reprised that role once again, next year (it's unknown if she has done some commercials earlier or not). In the same year she played in the TV movie Calendar Girl Murders (1984). But currently, her most popular was her her next role, which was Constance Flynn/Hazard from the ""North and South"" trilogy. In 1985, she met her future husband James Read. It was on the set of North & South: Book 1, North & South (1985). They played a married couple.They continued their affair during making North & South: Book 2, Love & War (1986) and finally got married two years later. They live in California and have at least one son; Jackson (born 1991). They remain in touch with other co-stars from ""North and South"" - Genie Francis and Jonathan Frakes (also married).Since ""North and South"" times Kilbourne has played in plenty of TV movies and a couple of TV series. None of them, though, has allowed her to become a big Hollywood star.",https://www.imdb.com/name/nm0452935/bio
"Gillian Robespierre was born on June 29, 1978 in Brooklyn, New York, USA. She is a director and writer, known for Obvious Child (2014), Landline (2017) and Untitled Divorce Comedy.",https://www.imdb.com/name/nm3521871/bio
